[
  {
    "scene": 1,
    "voiceover": "Replace this example voiceover with output generated by word_splitter.py.",
    "sub": "Replace this example voiceover with output generated by word_splitter.py.",
    "context_ref": "Replace this example context with the complete source sentence generated by word_splitter.py.",
    "sentence_id": 1,
    "part": "1/1",
    "continuity_ref": "opening",
    "shot_type": "wide",
    "veo_prompt": "Create exactly one uninterrupted continuous shot in one visual setup for the entire clip. Medium-wide eye-level cinematic shot in a quiet Buddhist monastery courtyard, weathered stone paving beneath a mature bodhi tree, dark timber columns and clay roof tiles softly receding in the background, a low lotus pond at the edge of frame. A generic middle-aged lay visitor in simple neutral linen clothing pauses beside a small hand-cast bronze meditation bell, his posture relaxed and facial expression restrained, not modeled on any real person. The camera performs one slow controlled 50mm lateral track of only a few feet while keeping the visitor and bell within the same composition; shallow-to-medium depth of field holds the hands, bell, and nearby bodhi leaves in clear focus while the monastery remains softly legible. Warm late-afternoon sunlight filters through heart-shaped leaves from camera-left, producing moving dappled highlights across stone and cloth as a light breeze gently shifts the foliage. The visitor lowers one open hand toward his side after a brief moment of stillness; no second action, location, time period, or symbolic transformation is introduced. The shot ends with the hand fully relaxed, the bronze bell unmoved, and one sunlit bodhi leaf drifting into the upper foreground, creating a calm visual handoff. premium cinematic Buddhist visual storytelling, mature semi-realistic 3D, warm amber tones. Natural earth colors, believable skin, linen, bronze, wood and stone materials, subtle atmospheric depth, restrained emotional realism. Negative: watermark, text overlay, burned-in subtitles, logo, childish cartoon style, chibi proportions, oversized cartoon eyes, anime exaggeration, toy-like plastic CGI, flat 2D illustration, overly bright neon colors, no real identifiable people, no celebrity likeness, no graphic violence, no gore, no nudity, no sexual content, no hate symbols, internal cuts, scene transitions, fades, dissolves, morph transitions, montage, time jumps, location changes, visual-domain changes"
  }
]
